{"schema_version":"kaiba.provisioning.rpi5-boot-signing-result/v1alpha1","plan_id":"plan:rpi5-finalizer-fixture:1","plan_digest":"sha256:77ba151d6602a518a287e3037ddbc885d77d5d6b93b41328d23d0e41acd0406d","boot_image_digest":"sha256:f72571867b6427c9e3efcc464f8d16321f0f28052462cec80cb4094689da8b37","boot_image_size_bytes":36,"boot_signature_digest":"sha256:cb0abd19b22419a9fde50b2b85bd72bdc22e3005a2eee874e00871ab446e72c0","boot_signature_size_bytes":602,"public_key_fingerprint":"sha256:104dbbf42aacd5c3357ed4229237f8d8d848af868b8f680b46cba5505d8f67fc","signer_policy_digest":"sha256:68498f57aa811b8a714260a4ac4390118c78efdb2af416cc64bfbd8eac4c42e3","gate_receipt_digest":"sha256:eced6ea3c3a42c7a0ee24e6cabf6338536e106faee65f5e2627ac55cbcd3ccb2","source_date_epoch":1786968000}
